idIngredient,strIngredient,strDescription,strThumb,strType
1,Chicken,"The chicken is a type of domesticated fowl, a subspecies of the red junglefowl (Gallus gallus). It is one of the most common and widespread domestic animals, with a total population of more than 19 billion as of 2011. There are more chickens in the world than any other bird or domesticated fowl. Humans keep chickens primarily as a source of food (consuming both their meat and eggs) and, less commonly, as pets. Originally raised for cockfighting or for special ceremonies, chickens were not kept for food until the Hellenistic period (4th–2nd centuries BC).

Genetic studies have pointed to multiple maternal origins in South Asia, Southeast Asia, and East Asia, but with the clade found in the Americas, Europe, the Middle East and Africa originating in the Indian subcontinent. From ancient India, the domesticated chicken spread to Lydia in western Asia Minor, and to Greece by the 5th century BC. Fowl had been known in Egypt since the mid-15th century BC, with the ""bird that gives birth every day"" having come to Egypt from the land between Syria and Shinar, Babylonia, according to the annals of Thutmose III.",https://www.themealdb.com/images/ingredients/chicken.png,
2,Salmon,"Salmon is the common name for several species of ray-finned fish in the family Salmonidae. Other fish in the same family include trout, char, grayling and whitefish. Salmon are native to tributaries of the North Atlantic (genus Salmo) and Pacific Ocean (genus Oncorhynchus). Many species of salmon have been introduced into non-native environments such as the Great Lakes of North America and Patagonia in South America. Salmon are intensively farmed in many parts of the world.

Typically, salmon are anadromous: they hatch in fresh water, migrate to the ocean, then return to fresh water to reproduce. However, populations of several species are restricted to fresh water through their lives. Folklore has it that the fish return to the exact spot where they hatched to spawn. Tracking studies have shown this to be mostly true. A portion of a returning salmon run may stray and spawn in different freshwater systems; the percent of straying depends on the species of salmon. Homing behavior has been shown to depend on olfactory memory. Salmon date back to the Neogene.",https://www.themealdb.com/images/ingredients/salmon.png,
3,Beef,"Beef is the culinary name for meat from cattle, particularly skeletal muscle. Humans have been eating beef since prehistoric times. Beef is a source of high-quality protein and nutrients.

Most beef skeletal muscle meat can be used as is by merely cutting into certain parts, such as roasts, short ribs or steak (filet mignon, sirloin steak, rump steak, rib steak, rib eye steak, hanger steak, etc.), while other cuts are processed (corned beef or beef jerky). Trimmings, on the other hand, are usually mixed with meat from older, leaner (therefore tougher) cattle, are ground, minced or used in sausages. The blood is used in some varieties called blood sausage. Other parts that are eaten include other muscles and offal, such as the oxtail, liver, tongue, tripe from the reticulum or rumen, glands (particularly the pancreas and thymus, referred to as sweetbread), the heart, the brain (although forbidden where there is a danger of bovine spongiform encephalopathy, BSE, commonly referred to as mad cow disease), the kidneys, and the tender testicles of the bull (known in the United States as calf fries, prairie oysters, or Rocky Mountain oysters). Some intestines are cooked and eaten as is, but are more often cleaned and used as natural sausage casings. The bones are used for making beef stock.",https://www.themealdb.com/images/ingredients/beef.png,
4,Pork,"Pork is the culinary name for the flesh of a domestic pig (Sus scrofa domesticus). It is the most commonly consumed meat worldwide,[1] with evidence of pig husbandry dating back to 5000 BC.

Pork is eaten both freshly cooked and preserved. Curing extends the shelf life of the pork products. Ham, smoked pork, gammon, bacon and sausage are examples of preserved pork. Charcuterie is the branch of cooking devoted to prepared meat products, many from pork.

Pig is the most popular meat in the Eastern and non-Muslim parts of Southeastern Asia (Indochina, Philippines, Singapore, East Timor) and is also very common in the Western world, especially in Central Europe. It is highly prized in Asian cuisines for its fat content and pleasant texture. Consumption of pork is forbidden by Jewish, Muslim and Rastafarian dietary law, for religious reasons, with several suggested possible causes.",https://www.themealdb.com/images/ingredients/pork.png,
5,Avocado,"The avocado, a tree with probable origin in South Central Mexico, is classified as a member of the flowering plant family Lauraceae. The fruit of the plant, also called an avocado (or avocado pear or alligator pear), is botanically a large berry containing a single large seed.

Avocados are commercially valuable and are cultivated in tropical and Mediterranean climates throughout the world. They have a green-skinned, fleshy body that may be pear-shaped, egg-shaped, or spherical. Commercially, they ripen after harvesting. Avocado trees are partially self-pollinating, and are often propagated through grafting to maintain predictable fruit quality and quantity. In 2017, Mexico produced 34% of the world supply of avocados.",https://www.themealdb.com/images/ingredients/avocado.png,
9,Apple Cider Vinegar,"Apple cider vinegar, or cider vinegar, is a vinegar made from fermented apple juice, and used in salad dressings, marinades, vinaigrettes, food preservatives, and chutneys. It is made by crushing apples, then squeezing out the juice. Bacteria and yeast are added to the liquid to start the alcoholic fermentation process, which converts the sugars to alcohol. In a second fermentation step, the alcohol is converted into vinegar by acetic acid-forming bacteria (Acetobacter species). Acetic acid and malic acid combine to give vinegar its sour taste. Apple cider vinegar has no medicinal or nutritional value. There is no high-quality clinical evidence that regular consumption of apple cider vinegar helps to maintain or lose body weight, or is effective to manage blood glucose and lipid levels.",https://www.themealdb.com/images/ingredients/apple_cider_vinegar.png,
10,Asparagus,"Asparagus, or garden asparagus, folk name sparrow grass, scientific name Asparagus officinalis, is a perennial flowering plant species in the genus Asparagus. Its young shoots are used as a spring vegetable.

It was once classified in the lily family, like the related Allium species, onions and garlic. However, genetic research places lilies, Allium, and asparagus in three separate families—the Liliaceae, Amaryllidaceae, and Asparagaceae, respectively—with the Amaryllidaceae and Asparagaceae being grouped together in the order Asparagales. Sources differ as to the native range of Asparagus officinalis, but generally include most of Europe and western temperate Asia. It is widely cultivated as a vegetable crop.",https://www.themealdb.com/images/ingredients/asparagus.png,
11,Aubergine,"Eggplant (US, Australia), aubergine (UK), or brinjal (South Asia and South Africa) is a plant species in the nightshade family Solanaceae. Solanum melongena is grown worldwide for its edible fruit.

Most commonly purple, the spongy, absorbent fruit is used in various cuisines. Although often considered a vegetable, it is a berry by botanical definition. As a member of the genus Solanum, it is related to tomato and potato. Like the tomato, its skin and seeds can be eaten, but, like the potato, it is usually eaten cooked. Eggplant is nutritionally low in macronutrient and micronutrient content, but the capability of the fruit to absorb oils and flavors into its flesh through cooking expands its use in the culinary arts.

It was originally domesticated from the wild nightshade species thorn or bitter apple, S. incanum, probably with two independent domestications: one in South Asia, and one in East Asia.",https://www.themealdb.com/images/ingredients/aubergine.png,
13,Baby Plum Tomatoes,"The tomato is the edible, often red, berry of the plant Solanum lycopersicum, commonly known as a tomato plant. The species originated in western South America and Central America. The Nahuatl (Aztec language) word tomatl gave rise to the Spanish word tomate, from which the English word tomato derived.[3][4] Its domestication and use as a cultivated food may have originated with the indigenous peoples of Mexico. The Aztecs used tomatoes in their cooking at the time of the Spanish conquest of the Aztec Empire, and after the Spanish encountered the tomato for the first time after their contact with the Aztecs, they brought the plant to Europe. From there, the tomato was introduced to other parts of the European-colonized world during the 16th century.",https://www.themealdb.com/images/ingredients/baby_plum_tomatoes.png,
14,Bacon,"Bacon is a type of salt-cured pork. Bacon is prepared from several different cuts of meat, typically from the pork belly or from back cuts, which have less fat than the belly. It is eaten on its own, as a side dish (particularly in breakfasts), or used as a minor ingredient to flavour dishes (e.g., the club sandwich). Bacon is also used for barding and larding roasts, especially game, including venison and pheasant. The word is derived from the Old High German bacho, meaning ""buttock"", ""ham"" or ""side of bacon"", and is cognate with the Old French bacon.",https://www.themealdb.com/images/ingredients/bacon.png,
15,Baking Powder,"Baking powder is a dry chemical leavening agent, a mixture of a carbonate or bicarbonate and a weak acid. The base and acid are prevented from reacting prematurely by the inclusion of a buffer such as cornstarch. Baking powder is used to increase the volume and lighten the texture of baked goods. It works by releasing carbon dioxide gas into a batter or dough through an acid-base reaction, causing bubbles in the wet mixture to expand and thus leavening the mixture. The first single-acting baking powder was developed by Birmingham based food manufacturer Alfred Bird in England in 1843. The first double-acting baking powder was developed by Eben Norton Horsford in America in the 1860s.",https://www.themealdb.com/images/ingredients/baking_powder.png,
16,Balsamic Vinegar,"Balsamic vinegar (Italian: aceto balsamico), occasionally shortened to balsamic, is a very dark, concentrated, and intensely flavoured vinegar originating in Italy, made wholly or partially from grape must. Grape must is freshly crushed grape juice with all the skins, seeds and stems.",https://www.themealdb.com/images/ingredients/balsamic_vinegar.png,
17,Basil,"Basil, also called great basil, is a culinary herb of the family Lamiaceae (mints).

Basil is native to tropical regions from central Africa to Southeast Asia. It is a tender plant, and is used in cuisines worldwide. Depending on the species and cultivar, the leaves may taste somewhat like anise, with a strong, pungent, often sweet smell.",https://www.themealdb.com/images/ingredients/basil.png,
18,Basil Leaves,"Basil, also called great basil, is a culinary herb of the family Lamiaceae (mints).
",https://www.themealdb.com/images/ingredients/basil_leaves.png,
19,Basmati Rice,"Basmati is a variety of long, slender-grained aromatic rice which is traditionally from the Indian subcontinent. As of 2018-19, India exported to over 90% of the overseas basmati rice market, while Pakistan accounted for the remainder, according to the Indian state-run Agricultural and Processed Food Products Export Development Authority  and the Pakistan government-run Economic Survey of Pakistan. Many countries use domestically grown basmati rice crops; however, basmati is geographically exclusive to select districts of India, Pakistan, Nepal and Bangladesh.",https://www.themealdb.com/images/ingredients/basmati_rice.png,
20,Bay Leaf,"The bay leaf is an aromatic leaf commonly used in cooking. It can be used whole, or as dried and ground.",https://www.themealdb.com/images/ingredients/bay_leaf.png,
21,Bay Leaves,"The bay leaf is an aromatic leaf commonly used in cooking. It can be used whole, or as dried and ground.",https://www.themealdb.com/images/ingredients/bay_leaves.png,
23,Beef Brisket,"Beef is the culinary name for meat from cattle, particularly skeletal muscle. Humans have been eating beef since prehistoric times. Beef is a source of high-quality protein and nutrients.

Most beef skeletal muscle meat can be used as is by merely cutting into certain parts, such as roasts, short ribs or steak (filet mignon, sirloin steak, rump steak, rib steak, rib eye steak, hanger steak, etc.), while other cuts are processed (corned beef or beef jerky). Trimmings, on the other hand, are usually mixed with meat from older, leaner (therefore tougher) cattle, are ground, minced or used in sausages. The blood is used in some varieties called blood sausage. Other parts that are eaten include other muscles and offal, such as the oxtail, liver, tongue, tripe from the reticulum or rumen, glands (particularly the pancreas and thymus, referred to as sweetbread), the heart, the brain (although forbidden where there is a danger of bovine spongiform encephalopathy, BSE, commonly referred to as mad cow disease), the kidneys, and the tender testicles of the bull (known in the United States as calf fries, prairie oysters, or Rocky Mountain oysters). Some intestines are cooked and eaten as is, but are more often cleaned and used as natural sausage casings. The bones are used for making beef stock.",https://www.themealdb.com/images/ingredients/beef_brisket.png,
24,Beef Fillet,"Beef is the culinary name for meat from cattle, particularly skeletal muscle. Humans have been eating beef since prehistoric times. Beef is a source of high-quality protein and nutrients.

Most beef skeletal muscle meat can be used as is by merely cutting into certain parts, such as roasts, short ribs or steak (filet mignon, sirloin steak, rump steak, rib steak, rib eye steak, hanger steak, etc.), while other cuts are processed (corned beef or beef jerky). Trimmings, on the other hand, are usually mixed with meat from older, leaner (therefore tougher) cattle, are ground, minced or used in sausages. The blood is used in some varieties called blood sausage. Other parts that are eaten include other muscles and offal, such as the oxtail, liver, tongue, tripe from the reticulum or rumen, glands (particularly the pancreas and thymus, referred to as sweetbread), the heart, the brain (although forbidden where there is a danger of bovine spongiform encephalopathy, BSE, commonly referred to as mad cow disease), the kidneys, and the tender testicles of the bull (known in the United States as calf fries, prairie oysters, or Rocky Mountain oysters). Some intestines are cooked and eaten as is, but are more often cleaned and used as natural sausage casings. The bones are used for making beef stock.",https://www.themealdb.com/images/ingredients/beef_fillet.png,
25,Beef Gravy,"Beef is the culinary name for meat from cattle, particularly skeletal muscle. Humans have been eating beef since prehistoric times. Beef is a source of high-quality protein and nutrients.

Most beef skeletal muscle meat can be used as is by merely cutting into certain parts, such as roasts, short ribs or steak (filet mignon, sirloin steak, rump steak, rib steak, rib eye steak, hanger steak, etc.), while other cuts are processed (corned beef or beef jerky). Trimmings, on the other hand, are usually mixed with meat from older, leaner (therefore tougher) cattle, are ground, minced or used in sausages. The blood is used in some varieties called blood sausage. Other parts that are eaten include other muscles and offal, such as the oxtail, liver, tongue, tripe from the reticulum or rumen, glands (particularly the pancreas and thymus, referred to as sweetbread), the heart, the brain (although forbidden where there is a danger of bovine spongiform encephalopathy, BSE, commonly referred to as mad cow disease), the kidneys, and the tender testicles of the bull (known in the United States as calf fries, prairie oysters, or Rocky Mountain oysters). Some intestines are cooked and eaten as is, but are more often cleaned and used as natural sausage casings. The bones are used for making beef stock.",https://www.themealdb.com/images/ingredients/beef_gravy.png,
26,Beef Stock,"Beef is the culinary name for meat from cattle, particularly skeletal muscle. Humans have been eating beef since prehistoric times. Beef is a source of high-quality protein and nutrients.

Most beef skeletal muscle meat can be used as is by merely cutting into certain parts, such as roasts, short ribs or steak (filet mignon, sirloin steak, rump steak, rib steak, rib eye steak, hanger steak, etc.), while other cuts are processed (corned beef or beef jerky). Trimmings, on the other hand, are usually mixed with meat from older, leaner (therefore tougher) cattle, are ground, minced or used in sausages. The blood is used in some varieties called blood sausage. Other parts that are eaten include other muscles and offal, such as the oxtail, liver, tongue, tripe from the reticulum or rumen, glands (particularly the pancreas and thymus, referred to as sweetbread), the heart, the brain (although forbidden where there is a danger of bovine spongiform encephalopathy, BSE, commonly referred to as mad cow disease), the kidneys, and the tender testicles of the bull (known in the United States as calf fries, prairie oysters, or Rocky Mountain oysters). Some intestines are cooked and eaten as is, but are more often cleaned and used as natural sausage casings. The bones are used for making beef stock.",https://www.themealdb.com/images/ingredients/beef_stock.png,
27,Bicarbonate Of Soda,"Sodium bicarbonate, commonly known as baking soda, is a chemical compound with the formula NaHCO3. It is a salt composed of a sodium cation (Na+) and a bicarbonate anion (HCO3−). Sodium bicarbonate is a white solid that is crystalline, but often appears as a fine powder. It has a slightly salty, alkaline taste resembling that of washing soda (sodium carbonate). The natural mineral form is nahcolite. It is a component of the mineral natron and is found dissolved in many mineral springs.",https://www.themealdb.com/images/ingredients/bicarbonate_of_soda.png,
28,Biryani Masala,"Biryani, also known as biriyani, biriani, birani or briyani, is a mixed rice dish with its origins among the Muslims of the Indian subcontinent. It can be compared to mixing a curry, later combining it with semi-cooked rice separately. This dish is especially popular throughout the Indian subcontinent, as well as among the diaspora from the region. It is also prepared in other regions such as Iraqi Kurdistan. It is made with Indian spices, rice, meat (chicken, goat, beef, lamb, prawn, or fish), vegetables or eggs.",https://www.themealdb.com/images/ingredients/biryani_masala.png,
29,Black Pepper,"Black pepper (Piper nigrum) is a flowering vine in the family Piperaceae, cultivated for its fruit, known as a peppercorn, which is usually dried and used as a spice and seasoning. When fresh and fully mature, it is about 5 mm (0.20 in) in diameter and dark red, and contains a single seed, like all drupes. Peppercorns and the ground pepper derived from them may be described simply as pepper, or more precisely as black pepper (cooked and dried unripe fruit), green pepper (dried unripe fruit), or white pepper (ripe fruit seeds).

Black pepper is native to present-day Kerala in Southwestern India, and is extensively cultivated there and elsewhere in tropical regions. Vietnam is the world's largest producer and exporter of pepper, producing 34% of the world's crop, as of 2013.",https://www.themealdb.com/images/ingredients/black_pepper.png,
30,Black Treacle,"Molasses (American English) or black treacle (British English) is a viscous product resulting from refining sugarcane or sugar beets into sugar. Molasses varies by amount of sugar, method of extraction, and age of plant. Sugarcane molasses is primarily used for sweetening and flavoring foods in the United States, Canada, and elsewhere. Molasses is a defining component of fine commercial brown sugar.

Sweet sorghum syrup may be colloquially called ""sorghum molasses"" in the southern United States.[2][3] Similar products include honey, maple syrup, corn syrup, and invert syrup. Most of these alternative syrups have milder flavors.",https://www.themealdb.com/images/ingredients/black_treacle.png,
31,Borlotti Beans,,https://www.themealdb.com/images/ingredients/borlotti_beans.png,
32,Bowtie Pasta,,https://www.themealdb.com/images/ingredients/bowtie_pasta.png,
33,Bramley Apples,,https://www.themealdb.com/images/ingredients/bramley_apples.png,
34,Brandy,,https://www.themealdb.com/images/ingredients/brandy.png,
35,Bread,,https://www.themealdb.com/images/ingredients/bread.png,
36,Breadcrumbs,,https://www.themealdb.com/images/ingredients/breadcrumbs.png,
37,Broccoli,,https://www.themealdb.com/images/ingredients/broccoli.png,
38,Brown Lentils,,https://www.themealdb.com/images/ingredients/brown_lentils.png,
39,Brown Rice,,https://www.themealdb.com/images/ingredients/brown_rice.png,
40,Brown Sugar,,https://www.themealdb.com/images/ingredients/brown_sugar.png,
41,Butter,,https://www.themealdb.com/images/ingredients/butter.png,
43,Cacao,,https://www.themealdb.com/images/ingredients/cacao.png,
44,Cajun,,https://www.themealdb.com/images/ingredients/cajun.png,
45,Canned Tomatoes,,https://www.themealdb.com/images/ingredients/canned_tomatoes.png,
46,Cannellini Beans,,https://www.themealdb.com/images/ingredients/cannellini_beans.png,
47,Cardamom,,https://www.themealdb.com/images/ingredients/cardamom.png,
49,Carrots,,https://www.themealdb.com/images/ingredients/carrots.png,
50,Cashew Nuts,,https://www.themealdb.com/images/ingredients/cashew_nuts.png,
51,Cashews,,https://www.themealdb.com/images/ingredients/cashews.png,
52,Caster Sugar,,https://www.themealdb.com/images/ingredients/caster_sugar.png,
53,Cayenne Pepper,,https://www.themealdb.com/images/ingredients/cayenne_pepper.png,
54,Celeriac,,https://www.themealdb.com/images/ingredients/celeriac.png,
55,Celery,,https://www.themealdb.com/images/ingredients/celery.png,
56,Celery Salt,,https://www.themealdb.com/images/ingredients/celery_salt.png,
57,Challots,,https://www.themealdb.com/images/ingredients/challots.png,
58,Charlotte Potatoes,,https://www.themealdb.com/images/ingredients/charlotte_potatoes.png,
59,Cheddar Cheese,,https://www.themealdb.com/images/ingredients/cheddar_cheese.png,
60,Cheese,,https://www.themealdb.com/images/ingredients/cheese.png,
61,Cheese Curds,,https://www.themealdb.com/images/ingredients/cheese_curds.png,
62,Cherry Tomatoes,,https://www.themealdb.com/images/ingredients/cherry_tomatoes.png,
63,Chestnut Mushroom,,https://www.themealdb.com/images/ingredients/chestnut_mushroom.png,
65,Chicken Breast,,https://www.themealdb.com/images/ingredients/chicken_breast.png,
66,Chicken Breasts,,https://www.themealdb.com/images/ingredients/chicken_breasts.png,
67,Chicken Legs,,https://www.themealdb.com/images/ingredients/chicken_legs.png,
68,Chicken Stock,,https://www.themealdb.com/images/ingredients/chicken_stock.png,
70,Chicken Thighs,,https://www.themealdb.com/images/ingredients/chicken_thighs.png,
71,Chickpeas,,https://www.themealdb.com/images/ingredients/chickpeas.png,
72,Chili Powder,,https://www.themealdb.com/images/ingredients/chili_powder.png,
73,Chilled Butter,,https://www.themealdb.com/images/ingredients/chilled_butter.png,
74,Chilli,,https://www.themealdb.com/images/ingredients/chilli.png,
75,Chilli Powder,,https://www.themealdb.com/images/ingredients/chilli_powder.png,
76,Chinese Broccoli,,https://www.themealdb.com/images/ingredients/chinese_broccoli.png,
77,Chocolate Chips,,https://www.themealdb.com/images/ingredients/chocolate_chips.png,
78,Chopped Onion,,https://www.themealdb.com/images/ingredients/chopped_onion.png,
79,Chopped Parsley,,https://www.themealdb.com/images/ingredients/chopped_parsley.png,
80,Chopped Tomatoes,,https://www.themealdb.com/images/ingredients/chopped_tomatoes.png,
81,Chorizo,,https://www.themealdb.com/images/ingredients/chorizo.png,
82,Christmas Pudding,,https://www.themealdb.com/images/ingredients/christmas_pudding.png,
83,Cilantro,,https://www.themealdb.com/images/ingredients/cilantro.png,
84,Cinnamon,,https://www.themealdb.com/images/ingredients/cinnamon.png,
85,Cinnamon Stick,,https://www.themealdb.com/images/ingredients/cinnamon_stick.png,
87,Cloves,,https://www.themealdb.com/images/ingredients/cloves.png,
88,Coco Sugar,,https://www.themealdb.com/images/ingredients/coco_sugar.png,
89,Cocoa,,https://www.themealdb.com/images/ingredients/cocoa.png,
90,Coconut Cream,,https://www.themealdb.com/images/ingredients/coconut_cream.png,
91,Coconut Milk,,https://www.themealdb.com/images/ingredients/coconut_milk.png,
92,Colby Jack Cheese,,https://www.themealdb.com/images/ingredients/colby_jack_cheese.png,
93,Cold Water,,https://www.themealdb.com/images/ingredients/cold_water.png,
94,Condensed Milk,,https://www.themealdb.com/images/ingredients/condensed_milk.png,
95,Coriander,,https://www.themealdb.com/images/ingredients/coriander.png,
96,Coriander Leaves,,https://www.themealdb.com/images/ingredients/coriander_leaves.png,
97,Coriander Seeds,,https://www.themealdb.com/images/ingredients/coriander_seeds.png,
98,Corn Tortillas,,https://www.themealdb.com/images/ingredients/corn_tortillas.png,
99,Cornstarch,,https://www.themealdb.com/images/ingredients/cornstarch.png,
100,Cream,,https://www.themealdb.com/images/ingredients/cream.png,
101,Creme Fraiche,,https://www.themealdb.com/images/ingredients/creme_fraiche.png,
