idIngredient,strIngredient,strDescription,strThumb,strType
702,Beef tomatoes,"Beef tomatoes, also known as beefsteak tomatoes, are large, meaty tomatoes prized for their robust flavor and texture, making them ideal for sandwiches, salads, and cooking.
Characteristics of Beef Tomatoes
Size and Shape: Beef tomatoes are among the largest varieties of cultivated tomatoes, often measuring up to 20 cm (7.9 inches) in diameter and weighing over 450 grams (1 lb). They typically have a kidney-like shape, with a smooth and glossy skin. 
2
Texture and Flavor: These tomatoes are known for their dense, fleshy pulp and high water content, which gives them a juicy and succulent texture. They have a rich, tangy flavor that is less acidic than many other tomato varieties, making them a favorite for fresh consumption. 
2
Color: Beef tomatoes are usually pink or red, but they can also be found in yellow, orange, and even purple varieties. 
2


4 Sources
Culinary Uses
Versatility: Beef tomatoes are incredibly versatile and can be used in a variety of dishes. They are commonly enjoyed in salads, sandwiches, and burgers due to their ability to hold their shape when sliced. 
2
Cooking: Their thick flesh makes them suitable for grilling, roasting, and baking, as they do not easily fall apart during cooking. 
2
Popular Dishes: They are often used in classic dishes like BLTs (bacon, lettuce, and tomato sandwiches) and Caprese salads, where their size and flavor can shine. 
2


3 Sources
Growing Beef Tomatoes
Cultivation: Beef tomatoes are typically grown in home gardens and are popular among gardeners due to their size and flavor. They are indeterminate varieties, meaning they continue to grow and produce fruit throughout the growing season. 
2
Care: These tomatoes require adequate sunlight, water, and support as they can grow quite tall. They are slower to mature compared to other tomato varieties, often taking up to 90 days to produce ripe fruit. 
1

In summary, beef tomatoes are a large, flavorful variety of tomato that is highly valued in culinary applications for their texture and taste. They are a staple in many kitchens and gardens, appreciated for their versatility and robust flavor.",https://www.themealdb.com/images/ingredients/Beef_tomatoes.png,Fruit
703,Semolina,"All About Semolina Flour - Differences Between Semolina and ...Semolina is a coarse, pale-yellow flour made from hard durum wheat. It is high in protein and gluten, making it ideal for making pasta, pizza, and bread. It can also be used to make puddings and other dishes. 
Key characteristics
Source: Durum wheat, a hard, high-protein wheat.
Appearance: Coarse, pale-yellow flour.
Gluten content: High, which gives it strength and elasticity.
Flavor: Mild and earthy. 
Common uses
Pasta: It is the traditional flour for making pasta, including spaghetti.
Bread: Used in baking for bread, pizza dough, and biscuits.
Puddings: In British cuisine, the term ""semolina"" can also refer to a sweet, creamy pudding made by cooking the flour in milk.
Other dishes: Used in recipes for couscous, gnocchi, and flatbreads like batbout. 
What to know
Semolina vs. other flours: Semolina is made from a different type of wheat than all-purpose flour, resulting in a different texture and protein content.
Dietary considerations: Because it is made from wheat, semolina is not gluten-free and is unsuitable for people with gluten disorders or wheat allergies. ",https://www.themealdb.com/images/ingredients/Semolina.png,Fruit
704,Ground Poppy seeds,"Ground poppy seeds are whole poppy seeds that have been milled into a powder, often sold pre-ground for convenience in cooking and baking. They have a nutty, slightly sweet flavor and are used in many cultures to make fillings for pastries and breads, thicken sauces, or add texture to dishes, and can also be stirred into breakfast items like yogurt or oatmeal. 
Culinary uses
Baking: Used to create fillings for pastries and cakes (like Hungarian bejgli and strudel), or mixed into batters and dough for added flavor and texture.
Thickening agent: In Indian and Turkish cooking, they are ground to thicken savory sauces and desserts.
Garnish: Sprinkled on top of breads, pastries, and other dishes for a decorative touch and nutty flavor.
Breakfast: Can be mixed into oatmeal, yogurt, or shakes for a protein-rich boost. 
Benefits and characteristics
Flavor: Has a nutty and slightly sweet taste, which can be enhanced by lightly roasting.
Nutrients: Contains minerals such as calcium, magnesium, phosphorus, and iron, along with dietary fiber and healthy fats.
Convenience: Pre-ground versions are available, making them easy to use without needing a grinder. ",https://www.themealdb.com/images/ingredients/Ground_Poppy_seeds.png,Grain
705,Bryndza cheese,"Bryndza is a traditional, salty sheep's milk cheese from Central and Eastern Europe, known for its soft, spreadable, and tangy flavor. It is white, crumbly, and often used in various regional dishes, though it does not melt well. While traditionally made from sheep's milk, it can sometimes include goat's or cow's milk as well. 
Key characteristics
Milk type: Traditionally made from sheep's milk, though cow's or goat's milk can be included.
Texture and color: It is a soft, white, and spreadable cheese that has a crumbly and granular form.
Flavor: It has a distinct salty and tangy flavor, often described as being slightly pungent or spicy.
Regional origin: It is a staple cheese in countries like Slovakia, Poland, and Ukraine, with its origins traced back to the Carpathian Mountains.
Uses: It is frequently used as a spread or as an ingredient in both hot and cold dishes, such as dumplings or pastries. It is also enjoyed fresh on its own. 
Production
Bryndza is typically made by milling aged sheep's cheese, sometimes mixed with cow's cheese, to create its characteristic smooth and spreadable consistency.
Some versions of Slovenská bryndza, a protected geographical indication in Slovakia, are made with a specific ratio of unpasteurized and pasteurized cheeses, notes AnyCheese. ",https://www.themealdb.com/images/ingredients/Bryndza_cheese.png,Cheese
706,Panang Curry Paste,"
Panang curry paste is a Thai curry paste made from a blend of dried chili peppers, lemongrass, galangal, makrut lime zest, garlic, shallots, and spices, often with ground peanuts, resulting in a sweet, savory, and slightly nutty flavor. It is a core component of the Panang curry dish, which is typically thicker and milder than red curry, with a richer and sweeter flavor profile that includes a hint of lime and the addition of peanuts. 
Key ingredients and characteristics
Base ingredients: Dried red chili peppers, lemongrass, galangal, garlic, and shallots form the foundation.
Flavor profile: Panang curry paste is characterized by a balance of sweet, salty, and savory tastes, with a distinct aroma from the herbs and spices.
Nutty flavor: A key difference from red curry is the inclusion of ground roasted peanuts, which adds a sweet, nutty dimension.
Aromatic additions: Ingredients like makrut lime zest, cilantro roots and seeds, and spices such as cumin, coriander, nutmeg, and star anise are commonly used.
Consistency: The paste is used to make a thicker, richer, and often creamier curry than other Thai curries like green curry. 
How it's used
To make Panang curry, the paste is typically fried in a small amount of oil, then simmered with coconut milk, protein (like beef or pork), and vegetables.
The result is a thick, aromatic sauce that pairs well with white jasmine rice. ",https://www.themealdb.com/images/ingredients/Panang_Curry_Paste.png,Sauce
707,makrut lime leaves,"Makrut lime leaves are the fragrant leaves of the Makrut lime tree, which are a staple in Southeast Asian cuisine, especially Thai cooking. They have a strong, aromatic citrus flavor and are used to infuse soups, curries, and stir-fries, similar to how bay leaves are used in the West. The leaves are typically added whole and removed before serving, or can be thinly sliced into dishes.  
Characteristics and appearance
Unique shape: Makrut lime leaves are easily identifiable by their ""double-leaf"" structure, where two leaf-shaped lobes are joined end-to-end on either side of a single stem, forming an hourglass or figure-eight shape. 
Appearance: They are thick, glossy, and emerald-green on top, with a matte pale green underside. 
Flavor profile: They offer a bright, potent citrus scent and a distinct flavor that is a complex mix of lime and other citrus notes, with a fresh, peppery quality. 
How to use them
Infusing dishes: Add the whole leaves to dishes like curries, soups, and stocks to impart their flavor. They should typically be removed before eating. 
Bruising: To release more of their aroma, gently bruise or crush the fresh leaves in your hands before adding them to the dish. 
Slicing: For a different texture and more intense flavor, you can also slice them very finely or pound them into a pulp to add to spice pastes or other ingredients. 
Dried leaves: Dried leaves are also available. You can use more of them than fresh leaves, as their flavor is not as strong. 
Where to find them
Asian supermarkets: You can find fresh leaves in the produce section. 
Spice aisle: Dried versions are often available in the spice aisle of mainstream grocery stores. 
Online retailers: Fresh and dried leaves can also be purchased online. 
",https://www.themealdb.com/images/ingredients/makrut_lime_leaves.png,Seasoning
708,Dried Red Chillies,"Dried red chillies are mature red chili peppers that have had their moisture removed, typically through sun or air drying, to preserve them and concentrate their heat and flavor. They are a staple spice used worldwide to add heat, color, and a complex, sometimes smoky, flavor to a wide range of dishes like curries, soups, stews, and sauces. 
Key characteristics
Preservation: Drying is a method for preserving chili peppers for year-round use.
Flavor: They can have an intense, fiery flavor that adds a slow-burn heat to food. The flavor can be adjusted by removing the seeds and pith, which contain a lot of the heat.
Color: They add a vibrant red hue to dishes.
Versatility: They can be used whole, crushed (as chili flakes), or ground into a powder. 
Common uses
Soups and stews: They can elevate soups, stews, and braised dishes.
Stir-fries: They are used to create the core flavor in many stir-fries.
Curries and sauces: They are a key ingredient in many curries, sauces, and pastes.
Spice blends: They are used to make spice blends, such as garam masala or chili powder.
Infused oils: They can be used to make chili-infused oils. ",https://www.themealdb.com/images/ingredients/Dried_Red_Chillies.png,Root Vegetable
709,Shrimp Paste,"Shrimp paste is a fermented condiment made from ground shrimp mixed with salt, used extensively in Southeast Asian and coastal Chinese cooking. It adds a pungent, salty, and umami flavor to dishes like curries, stir-fries, and dipping sauces. The paste is typically cooked before use, often by frying it in oil to release its complex flavor. 
What it is
Made from: Tiny shrimp or krill are mixed with salt, fermented, and then pounded into a paste.
Flavor profile: It has an intense, pungent aroma and a deep, savory, salty, and umami flavor.
Regional names: It is known by different names depending on the region, such as kapi in Thailand, belacan in Malaysia, and terasi in Indonesia. 
How to use it
Add sparingly: Due to its potent flavor, you only need a small amount.
Cook first: Always cook shrimp paste before eating. Gently frying it in a little oil until fragrant is a common way to prepare it for dishes.
Versatile ingredient: It can be used to enhance a variety of dishes.
Curries
Stir-fries
Dipping sauces (like sambals and nam prik gapi)
Marinades
Soups 
Storage
Keep the paste refrigerated in an airtight container after opening to preserve it. ",https://www.themealdb.com/images/ingredients/Shrimp_Paste.png,Sauce
710,Galangal,"Galangal is an aromatic root from the same family as ginger and turmeric, used as a key ingredient in many Southeast Asian cuisines like Thai, Indonesian, and Malaysian food. It has a tougher, more fibrous texture and a sharper, more citrusy and piney flavor compared to ginger, which is earthier. It is often used in dishes like curries, soups, and broths and can be purchased fresh, dried, or ground. 
Key characteristics and uses
Family: Galangal is part of the Zingiberaceae family, which also includes ginger and turmeric.
Appearance: It resembles ginger but is typically rounder, smoother, and paler, with a harder flesh.
Flavor: It has a pungent, citrusy, and piney flavor, which is more pronounced than ginger's milder, earthier taste.
Culinary uses:
Curries and pastes: It is a staple in Thai curry pastes, often pounded into a paste with other ingredients.
Soups and broths: Thin slices can be simmered in broths to infuse flavor before being removed, as it is too tough to eat in large pieces.
Stir-fries and stews: It can be diced or sliced and added to stir-fries, stews, and sauces.
Availability: It can be found fresh, dried (in slices or powdered form), and is often available in Asian grocery stores.
Traditional medicine: It has been used for centuries in traditional medicine and is believed to have benefits like reducing inflammation and fighting infections. ",https://www.themealdb.com/images/ingredients/Galangal.png,Seasoning
711,Lemongrass,"Lemongrass is a fragrant, citrus-scented grass native to Asia and Africa that is widely used as a culinary herb in Southeast Asian and other cuisines. It has a lemony flavor and aroma, despite not being sour, and can be used in soups, curries, salads, and teas. It is prepared by finely chopping the tender inner part of the stalk or by bruising the whole stalk to release its aromatic oils. 
Culinary uses
Soups and curries: The stalk is often added whole to infuse broths with its flavor before being removed, or it can be finely chopped and cooked into the dish.
Salads and sauces: Finely minced lemongrass adds a bright, citrusy note to fresh salads and various sauces.
Tea: Lemongrass leaves can be used to make a fragrant and refreshing tea, often for its perceived health benefits.
Marinades: It is used in marinades for meats and seafood to add a unique, aromatic flavor. 
Preparation
To use the stalk for cooking, trim the bottom and peel off the tough outer layers.
For recipes, only the lower 7-8 cm of the stalk is typically used and can be chopped finely or pounded into a paste.
Bruising the stalk with a rolling pin helps to release more of its aromatic oils when added to a dish whole. 
Other uses
Insect repellent: Lemongrass contains citronella, which is a natural insect repellent.
Aromatherapy: The essential oil is used as a natural air freshener and can be used in homemade candles or potpourri for its pleasant scent.
Traditional medicine: In some traditional medicine systems, lemongrass is used for its purported properties, such as its calming effects, antibacterial and antifungal agents. ",https://www.themealdb.com/images/ingredients/Lemongrass.png,Seasoning
712,Ground Coriander,"Ground coriander is the powdered form of the dried, mature seed of the coriander plant, which is also the source of the fresh herb cilantro. It has a warm, nutty, and slightly citrusy flavor that is different from the fresh leaves. This versatile spice is a staple in many cuisines, including Indian, Mexican, and Middle Eastern, and is used in dishes like curries, stews, and spice blends. 
Flavor profile: The flavor is warm, earthy, and slightly sweet with a hint of citrus. Roasting the seeds before grinding can intensify its flavor.
Culinary uses: It can be added to a wide variety of savory dishes like curries, soups, and stews, as well as to roasted vegetables, meats, and legumes. It can also be used in sweet applications like baked goods and breads.
Cuisine staple: Ground coriander is a key ingredient in many spice blends, such as garam masala, ras el hanout, and various curry powders. It is particularly important in Indian and Middle Eastern cooking.
Versatility: It is considered a very versatile spice, often paired with other spices like cumin. It is a great foundational spice for beginner cooks to have on hand.
From plant to powder: The term ""coriander"" can refer to both the seeds and the leaves of the plant, which is known as cilantro. The ground version is made from the seeds, while the fresh leaves are used separately as an herb. ",https://www.themealdb.com/images/ingredients/Ground_Coriander.png,Seasoning
713,Ground Nutmeg,"Ground nutmeg is the powdered spice made from the seed of the tropical Myristica fragrans tree. It has a warm, sweet, and slightly pungent flavor that is used in both sweet and savory dishes, like baked goods, custards, curries, and soups. It's a more convenient alternative to whole nutmegs, but it loses its potency more quickly, so it's best to buy it from a fresh source and store it properly, or grind whole nutmegs as needed. 
Flavor and uses
Flavor: A warm, subtly sweet flavor with nutty and woody undertones.
Sweet dishes: Delicious in cakes, cookies, pies (especially pumpkin pie), and puddings, and adds warmth to drinks like lattes and mulled wine.
Savory dishes: Pairs well with creamy sauces, mashed potatoes, and vegetables, and can add depth to stews, curries, and meat dishes. 
Sourcing and storage
Source: It is made by drying and grinding the seeds of the nutmeg tree.
Storage: Ground nutmeg loses its flavor faster than whole nutmeg, so it should be stored in a cool, dark, dry place and is best used within a few months of opening.
Freshness: For the freshest flavor, it is recommended to buy whole nutmegs and grind them just before use. 
Did you know?
Despite its name, nutmeg is a seed, not a nut.
Mace is a related spice that comes from the outer covering of the nutmeg seed and has a similar but milder flavor. ",https://www.themealdb.com/images/ingredients/Ground_Nutmeg.png,Seasoning
714,Flat Rice Noodles,"Flat rice noodles are a type of rice noodle that are wide and flat, with a soft and chewy texture. They are a staple in many Asian cuisines and are used in dishes like stir-fries (such as Pad Thai, Pad See Ew, or Beef Chow Fun) or noodle soups. 
Ingredients: They are primarily made from rice flour and water, though some recipes and store-bought versions may add potato, tapioca, or corn starch to improve their texture.
Variations: They can be found fresh, dried, or frozen, and their thickness can vary, with common names including Hor Fun, Shahe fen, and Kuey Teow.
Characteristics: Fresh versions are often coated in a light oil to prevent sticking and are best used the same day they are made, as refrigeration can make them brittle. They are known for their ability to absorb the flavors of sauces and other ingredients.
Cooking: They are typically cooked by soaking them in warm water until soft, rather than boiling, and are then added to stir-fries or soups. 
",https://www.themealdb.com/images/ingredients/Flat_Rice_Noodles.png,Pasta
715,Birds-eye Chillies,"
Bird's eye chilies are small, very hot peppers, measuring around 50,000 to 100,000 Scoville Heat Units (SHU). They are a staple in many Southeast Asian cuisines like Thai and are also known as Prik Kee Noo. They can be used fresh, dried, or ground into a powder and are named for their small, pointed shape and because birds are known to disperse their seeds. 
Key characteristics
Heat level: They are significantly hotter than a jalapeño but not as hot as a habanero.
Shape and color: The plant produces small, thin, pointed peppers that are green when unripe and turn red when ripe.
Origin: They are commonly found in Southeast Asian countries like Thailand, Laos, and Vietnam, though other varieties may originate from places like Africa.
Flavor: They provide a fruity and peppery taste with a punch of heat.
Culinary uses: They are used to add spice to a wide variety of dishes, including curries, sauces, and stir-fries. They can also be used as a garnish or a condiment, often dried and ground into a powder. 
How they are used
In cooking: Thinly sliced and added to curries, stir-fries, and sauces.
As a condiment: Dried and ground into a powder that can be placed on the table for diners to add to their food.
As a garnish: Sliced fresh and sprinkled over salads.
In drinks: Used to add a spicy kick to cocktails. 
Storage
Fresh: Store in the refrigerator's crisper drawer for up to two weeks. Do not rinse until ready to use to prevent decay.
Dried: Properly canned or dried chilies can last at room temperature for up to a year. ",https://www.themealdb.com/images/ingredients/Birds-eye_Chillies.png,Root Vegetable
716,Sirloin steak,"Sirloin steak is a flavorful cut of beef from the middle to the rear section of the cow's back, known for being lean but having a robust taste. It is a versatile and popular cut that can be pan-fried, grilled, or barbecued and is suitable for a range of cooking levels from rare to well-done. 
What it is
From where: It comes from the sirloin section, which is on the cow's back, situated between the fore-rib and the rump.
Characteristics: Sirloin is a lean cut with larger muscle fibers. It has a strong flavor and can have a layer of fat along one edge, which provides moisture and flavor.
Tenderness: While it can be less tender than cuts from areas that do less work, it remains juicy and has a rich taste. 
How to cook it
Cooking methods: Sirloin is well-suited for high-heat methods like pan-frying, griddling, or grilling.
Preparation: For best results, allow the steak to come to room temperature before cooking.
Cooking time: Cooking times vary based on desired doneness. For a 2cm thick sirloin steak, a general guideline is:
Rare: 1-2 minutes per side
Medium-rare: 2 minutes per side
Medium: 2-3 minutes per side
Resting: After cooking, it's essential to let the steak rest for at least five minutes before serving. ",https://www.themealdb.com/images/ingredients/Sirloin_steak.png,Meat
717,Lemongrass Stalks,"
Lemongrass stalks are the thick, woody, green and yellow stems of the Cymbopogon citratus plant, which are used as a culinary herb for their bright, lemony flavor. They resemble large spring onions but have a tougher, more fibrous texture and are primarily used in Southeast Asian cooking, though they also appear in Western dishes. The flavor comes from aromatic oils, which are released when the stalk is bruised, pounded, or chopped. 
Uses
Flavoring: Lemongrass adds a fresh, citrusy note to a wide variety of dishes, especially soups, curries, and stir-fries. It can be used whole, bruised, sliced, or finely chopped to infuse flavor.
Tea: The leaves can be used to make a light, lemony tea.
Garnish: The stalks can be used as skewers for kebabs. 
Preparation
Preparation is key: The tough, fibrous outer layers of the stalk should be peeled off before use.
Bruising: For a more intense flavor, bruise the stalk with the back of a knife or a rolling pin before adding it to a dish.
Chopping/pounding: The bottom 3-4 inches of the stalk are the most edible and flavorful part. It is important to finely chop or pound this section before cooking, as the upper portion is too tough and woody.
Removing: If using the stalk whole for flavor, it is recommended to remove it before serving the dish. 
Shopping and storage
Selection: Choose firm, heavy stalks that are green and yellow at the ends and show no signs of bruising.
Storage: Fresh stalks can be stored in the freezer for up to a month, wrapped well.
Freeze-dried: Freeze-dried stalks are also available, which can be reconstituted in warm water before use. ",https://www.themealdb.com/images/ingredients/Lemongrass_Stalks.png,Seasoning
718,Oyster Mushrooms,"Oyster mushrooms are a type of edible fungus from the Pleurotus genus, named for their oyster-like shape and color. They are one of the most commonly cultivated mushrooms, known for their delicate texture and mild, savory flavor. Oyster mushrooms are also found in the wild, growing in clusters on decaying hardwood trees. 
Appearance and Habitat
Shape and color: They have a fan or oyster-shaped cap that is typically grayish-brown, though other colors like yellow and pink exist.
Growth: They grow in shelf-like clusters on dead or dying hardwood trees, such as beech, maple, and aspen.
Gills: They have white or cream-colored gills that run down the stem, which is very short or completely absent. 
Culinary Use
Flavor: They have a mild, savory, and slightly anise-like flavor.
Texture: They are soft and delicate.
Cooking: They work well in a variety of dishes, including soups, stir-fries, and pasta. They can also be sautéed or fried.
Raw consumption: Some people can have a slight allergic reaction to raw oyster mushrooms, so it is best to cook them. 
Cultivation
Easy to grow: They are one of the easiest mushrooms to cultivate because they grow quickly on a wide variety of substrates, like straw and wood chips.
Availability: Due to cultivation, they are widely available in grocery stores worldwide. ",https://www.themealdb.com/images/ingredients/Oyster_Mushrooms.png,Mushroom
