idIngredient,strIngredient,strDescription,strThumb,strType
570,Pork Chops,"A pork chop, like other meat chops, is a loin cut taken perpendicular to the spine of the pig and usually containing a rib or part of a vertebra. Pork chops are not processed and are leaner than other cuts of pork. Chops are commonly served as an individual portion.",https://www.themealdb.com/images/ingredients/pork_chops.png,Meat
571,Yukon Gold Potatoes,"Yukon Gold is a large cultivar of potato most distinctly characterized by its thin, smooth, eye-free skin and yellow-tinged flesh. This potato was developed in the 1960s by Garnet Johnston in Guelph, Ontario, Canada, with the help of Geoff Rowberry at the University of Guelph. The official cross was made in 1966 and Yukon Gold was finally released into the market in 1980.",https://www.themealdb.com/images/ingredients/yukon_gold_potatoes.png,Root Vegetable
572,Yellow Onion,"The brown onion or yellow onion is a variety of dry onion with a strong flavour. They have a greenish-white, light yellow, or white inside; its layers of papery skin have a yellow-brown or pale golden colour",https://www.themealdb.com/images/ingredients/yellow_onion.png,Vegetable
573,Beef Stock Concentrate,"Stock, sometimes called bone broth, is a savory cooking liquid that forms the basis of many dishes, particularly soups, stews and sauces. Making stock involves simmering animal bones or meat, seafood, or vegetables in water or wine, often for an extended period of time. Mirepoix or other aromatics may be added for more flavor.",https://www.themealdb.com/images/ingredients/beef_stock_concentrate.png,Stock
574,Chicken Stock Concentrate,"Stock, sometimes called bone broth, is a savory cooking liquid that forms the basis of many dishes, particularly soups, stews and sauces. Making stock involves simmering animal bones or meat, seafood, or vegetables in water or wine, often for an extended period of time. Mirepoix or other aromatics may be added for more flavor.",https://www.themealdb.com/images/ingredients/chicken_stock_concentrate.png,Stock
575,Persian Cucumber,"Cucumber (Cucumis sativus) is a widely cultivated plant in the gourd family, Cucurbitaceae. It is a creeping vine that bears cucumiform fruits that are used as vegetables. There are three main varieties of cucumber: slicing, pickling, and seedless. Within these varieties, several cultivars have been created. In North America, the term ""wild cucumber"" refers to plants in the genera Echinocystis and Marah, but these are not closely related. The cucumber is originally from South Asia, but now grows on most continents. Many different types of cucumber are traded on the global market.",https://www.themealdb.com/images/ingredients/persian_cucumber.png,Vegetable
576,Mayonnaise,"Mayonnaise, informally mayo is a thick cold condiment or dressing commonly used in sandwiches and composed salads or on French fries. It is also a base in sauces such as Tartar sauce.",https://www.themealdb.com/images/ingredients/mayonnaise.png,Sauce
577,Sriracha,"Sriracha is a type of hot sauce or chili sauce made from a paste of chili peppers, distilled vinegar, garlic, sugar, and salt.",https://www.themealdb.com/images/ingredients/sriracha.png,Sauce
578,Rhubarb,"Rhubarb is a general term used for the cultivated plants in the genus Rheum in the family Polygonaceae. It is a herbaceous perennial growing from short, thick rhizomes. Historically, different plants have been called ""rhubarb"" in English.",https://www.themealdb.com/images/ingredients/rhubarb.png,Vegetable
579,Pita Bread,"Pita or pitta, is a family of yeast-leavened round flatbreads baked from wheat flour, common in the Mediterranean, Middle East, and neighboring areas.",https://www.themealdb.com/images/ingredients/pita_bread.png,Bread
580,Bulgur Wheat,"Bulgur is a cereal food made from the cracked parboiled groats of several different wheat species, most often from durum wheat. It originates in Middle Eastern cuisine.",https://www.themealdb.com/images/ingredients/bulgur_wheat.png,Cereal
581,Quinoa,"Quinoa is a flowering plant in the amaranth family. It is an herbaceous annual plant grown as a crop primarily for its edible seeds; the seeds are rich in protein, dietary fiber, B vitamins, and dietary minerals in amounts greater than in many grains.",https://www.themealdb.com/images/ingredients/quinoa.png,Grain
582,Dill Pickles,"A pickled cucumber is a cucumber that has been pickled in a brine, vinegar, or other solution and left to ferment for a period of time, by either immersing the cucumbers in an acidic solution or through souring by lacto-fermentation. Pickled cucumbers are often part of mixed pickles.",https://www.themealdb.com/images/ingredients/dill_pickles.png,Vegetable
583,Sesame Seed Burger Buns,"A bun is a small, sometimes sweet, bread-based item or roll. Though they come in many shapes and sizes, they are most commonly hand-sized or smaller, with a round top and flat bottom. Buns are usually made from flour, sugar, milk, yeast and butter.",https://www.themealdb.com/images/ingredients/sesame_seed_burger_buns.png,Bread
585,Buns,"A bun is a small, sometimes sweet, bread-based item or roll. Though they come in many shapes and sizes, they are most commonly hand-sized or smaller, with a round top and flat bottom. Buns are usually made from flour, sugar, milk, yeast and butter.",https://www.themealdb.com/images/ingredients/buns.png,Bread
586,Iceberg Lettuce,Iceberg is a variety of lettuce with crisp leaves that grow in a spherical head resembling cabbage. It is considered one of the sweeter lettuce varieties like romaine and butterhead. Mature iceberg lettuce grows to about one foot in diameter.,https://www.themealdb.com/images/ingredients/iceberg_lettuce.png,Vegetable
587,Gherkin Relish,"A relish is a cooked and pickled product made of chopped vegetables, fruits or herbs and is a food item typically used as a condiment to enhance a staple. Examples are chutneys and the North American relish, a pickled cucumber jam eaten with hot dogs or hamburgers.",https://www.themealdb.com/images/ingredients/gherkin_relish.png,Sauce
588,Cheese Slices,"Processed cheese is a food product made from cheese and other unfermented dairy ingredients mixed with emulsifiers. Additional ingredients, such as vegetable oils, salt, food coloring, or sugar may be included. As a result, many flavors, colors, and textures of processed cheese exist.",https://www.themealdb.com/images/ingredients/cheese_slices.png,Cheese
589,Shortening,"Shortening is any fat that is a solid at room temperature and used to make crumbly pastry and other food products. Although butter is solid at room temperature and is frequently used in making pastry, the term ""shortening"" seldom refers to butter, but is more closely related to margarine.",https://www.themealdb.com/images/ingredients/shortening.png,Fat
590,Warm Water,"Water is an inorganic, transparent, tasteless, odorless, and nearly colorless chemical substance, which is the main constituent of Earth's hydrosphere and the fluids of most living organisms. It is vital for all known forms of life, even though it provides no calories or organic nutrients. Its chemical formula is H2O, meaning that each of its molecules contains one oxygen and two hydrogen atoms, connected by covalent bonds. Water is the name of the liquid state of H2O at standard ambient temperature and pressure. It forms precipitation in the form of rain and aerosols in the form of fog. Clouds are formed from suspended droplets of water and ice, its solid state. When finely divided, crystalline ice may precipitate in the form of snow. The gaseous state of water is steam or water vapor. Water moves continually through the water cycle of evaporation, transpiration (evapotranspiration), condensation, precipitation, and runoff, usually reaching the sea.",https://www.themealdb.com/images/ingredients/warm_water.png,Liquid
591,Boiling Water,"Water is an inorganic, transparent, tasteless, odorless, and nearly colorless chemical substance, which is the main constituent of Earth's hydrosphere and the fluids of most living organisms. It is vital for all known forms of life, even though it provides no calories or organic nutrients. Its chemical formula is H2O, meaning that each of its molecules contains one oxygen and two hydrogen atoms, connected by covalent bonds. Water is the name of the liquid state of H2O at standard ambient temperature and pressure. It forms precipitation in the form of rain and aerosols in the form of fog. Clouds are formed from suspended droplets of water and ice, its solid state. When finely divided, crystalline ice may precipitate in the form of snow. The gaseous state of water is steam or water vapor. Water moves continually through the water cycle of evaporation, transpiration (evapotranspiration), condensation, precipitation, and runoff, usually reaching the sea.",https://www.themealdb.com/images/ingredients/boiling_water.png,Liquid
592,Pickle Juice,"Pickling is the process of preserving or extending the shelf life of food by either anaerobic fermentation in brine or immersion in vinegar. In East Asia, vinaigrette is also used as a pickling medium. The pickling procedure typically affects the food's texture, taste and flavor.",https://www.themealdb.com/images/ingredients/pickle_juice.png,Juice
593,Powdered Sugar,"Powdered sugar, also called confectioners' sugar or icing sugar, is a finely ground sugar produced by milling granulated sugar into a powdered state. It usually contains a small amount of anti-caking agent to prevent clumping and improve flow",https://www.themealdb.com/images/ingredients/powdered_sugar.png,Sugar
594,Kielbasa,"Kielbasa is any type of meat sausage from Poland, and a staple of Polish cuisine. In American English the word typically refers to a coarse, U-shaped smoked sausage of any kind of meat, which closely resembles the Wiejska sausage in British English.",https://www.themealdb.com/images/ingredients/kielbasa.png,Meat
595,Polish Sausage,"Kielbasa is any type of meat sausage from Poland, and a staple of Polish cuisine. In American English the word typically refers to a coarse, U-shaped smoked sausage of any kind of meat, which closely resembles the Wiejska sausage in British English.",https://www.themealdb.com/images/ingredients/polish_sausage.png,Meat
596,Sauerkraut,"Sauerkraut is finely cut raw cabbage that has been fermented by various lactic acid bacteria. It has a long shelf life and a distinctive sour flavor, both of which result from the lactic acid formed when the bacteria ferment the sugars in the cabbage leaves.",https://www.themealdb.com/images/ingredients/sauerkraut.png,Vegetable
597,Caraway Seed,"Caraway, also known as meridian fennel and Persian cumin (Carum carvi), is a biennial plant ... For example, it is used in goulash, sauerkraut, and caraway seed cake. The roots may be cooked as a vegetable like parsnips or carrots",https://www.themealdb.com/images/ingredients/caraway_seed.png,Spice
598,Herring,"Herring are forage fish, mostly belonging to the family Clupeidae. Herring often move in large schools around fishing banks and near the coast, found particularly in shallow, temperate waters of the North Pacific and North Atlantic Oceans, including the Baltic Sea, as well as off the west coast of South America.",https://www.themealdb.com/images/ingredients/herring.png,Fish
599,Jam,"Fruit preserves are preparations of fruits, vegetables and sugar, often stored in glass jam jars and Mason jars.

Many varieties of fruit preserves are made globally, including sweet fruit preserves, such as those made from strawberry or apricot, and savory preserves, such as those made from tomatoes or squash. The ingredients used and how they are prepared determine the type of preserves; jams, jellies, and marmalades are all examples of different styles of fruit preserves that vary based upon the fruit used. In English, the word, in plural form, ""preserves"" is used to describe all types of jams and jellies.",https://www.themealdb.com/images/ingredients/jam.png,Preserve
600,Mulukhiyah,"Mulukhiyah , molokheyya ,molokhia or mulukhiyyah (Arabic: ملوخية‎ mulūkhiyyah) Greek : molokha is the leaves of Corchorus olitorius, commonly known in English as jute, nalta jute, tossa jute , jute mallow or Jew's mallow. It is used as a vegetable. It is popular in Middle East, East African and North African countries and is called “Saluyot” in the Philippines. Mulukhiyah is rather bitter, and when boiled, the resulting liquid is a thick, highly mucilaginous broth; it is often described as ""slimy"", rather like cooked okra. Mulukhiyah is generally eaten cooked, not raw, and is most frequently turned into a kind of soup or stew, typically bearing the same name as the vegetable in the local language. Traditionally mulukhiyah is cooked with chicken or at least chicken stock for flavor and is served with white rice, accompanied with lemon or lime.",https://www.themealdb.com/images/ingredients/mulukhiyah.png,Vegetable
601,Sushi Rice,"As the dietary staple of Japan, knowing how to cook Japanese rice is an important first step to becoming a Japanese cooking master. Perfectly prepared Japanese rice should be light, fluffy, and slightly sticky when cooked",https://www.themealdb.com/images/ingredients/sushi_rice.png,Rice
602,Figs,"Ficus carica is an Asian species of flowering plant in the mulberry family, known as the common fig. It is the source of the fruit also called the fig and as such is an important crop in those areas where it is grown commercially.",https://www.themealdb.com/images/ingredients/figs.png,Fruit
603,Cider,"Cider (/ˈsaɪdər/ SY-dər) is an alcoholic beverage made from the fermented juice of apples. Cider is widely available in the United Kingdom (particularly in the West Country) and the Republic of Ireland. The UK has the world's highest per capita consumption, as well as its largest cider-producing companies. Ciders from the South West of England are generally stronger. Cider is also popular in many Commonwealth countries, such as India, Canada, Australia, and New Zealand. As well as the UK and its former colonies, cider is popular in Portugal (mainly in Minho and Madeira), France (particularly Normandy and Brittany), northern Italy (Piedmont and Friuli), and northern Spain (especially the Principality of Asturias and the Basque Country). Central Europe also has its own types of cider with Rhineland-Palatinate and Hesse producing a particularly tart version known as Apfelwein. In the U.S., varieties of fermented cider are often called hard cider to distinguish alcoholic cider from non-alcoholic apple cider or ""sweet cider"", also made from apples. In Canada, cider cannot be called cider if there are no apples. Furthermore, according to the Food and Drug Regulations in Canada, cider cannot contain less than 2.5% or over 13% absolute alcohol by volume.",https://www.themealdb.com/images/ingredients/cider.png,Drink
604,Beetroot,"The beetroot is the taproot portion of a beet plant, usually known in Canada and the USA as beets while the vegetable is referred to as beetroot in British English, and also known as the table beet, garden beet, red beet, dinner beet or golden beet.",https://www.themealdb.com/images/ingredients/beetroot.png,Vegetable
605,Sardines,"""Sardine"" and ""pilchard"" are common names that refer to various small, oily forage fish in the herring family Clupeidae. The term ""sardine"" was first used in English during the early 15th century and may come from the Mediterranean island of Sardinia, around which sardines were once abundant.",https://www.themealdb.com/images/ingredients/sardines.png,Seafood
606,Ciabatta,"Ciabatta is an Italian white bread made from wheat flour, water, salt, yeast and olive oil, created in 1982 by a baker in Adria, province of Rovigo, Veneto, Italy, in response to the popularity of French baguettes.",https://www.themealdb.com/images/ingredients/ciabatta.png,Bread
607,Buckwheat,"Buckwheat (Fagopyrum esculentum), or common buckwheat, is a plant cultivated for its grain-like seeds and as a cover crop. The name ""buckwheat"" is used for several other species, such as Fagopyrum tataricum, a domesticated food plant raised in Asia. Despite the name, buckwheat is not closely related to wheat, as it is not a grass. Instead, buckwheat is related to sorrel, knotweed, and rhubarb. Buckwheat is referred to as a pseudocereal because its seeds' culinary use is the same as cereals', owing to their composition of complex carbohydrates.",https://www.themealdb.com/images/ingredients/buckwheat.png,Grain
608,Prunes,"A prune is a dried plum, most commonly from the European plum. Not all plum species or varieties can be dried into prunes. A prune is the firm-fleshed fruit (plum) of Prunus domestica varieties that have a high soluble solids content, and do not ferment during drying. Use of the term ""prune"" for fresh plums is obsolete except when applied to varieties of plum grown for drying.",https://www.themealdb.com/images/ingredients/prunes.png,Fruit
609,Grape leaves,"Grape leaves are the young, edible leaves from a grapevine, widely used in Mediterranean, Balkan, Middle Eastern, and Caucasus cuisines for dishes like dolma (stuffed grape leaves). They are prepared fresh or preserved in jars and offer a unique, tangy, citrusy flavor to recipes with a tender texture when cooked.",https://www.themealdb.com/images/ingredients/Grape_leaves.png,Vegetable
610,Falafel,"Falafel are deep-fried fritters made from ground chickpeas or fava beans, herbs, and spices, popular in Middle Eastern cuisine. They are often served as a street food, stuffed into a pita or flatbread with vegetables, tahini sauce, and pickles. Falafel can be made at home by shaping the mixture into balls or patties and frying them until golden brown and crispy.",https://www.themealdb.com/images/ingredients/falafel.png,Bread
611,Green Cardamom Pods,"Cardamom is an aromatic spice from the seeds of plants in the ginger family, used to add a warm, sweet, and pungent flavor to both savory and sweet dishes. It is native to the Indian subcontinent and Indonesia, and is known for its potential health benefits, such as aiding digestion, controlling blood pressure, and boosting the immune system due to its antioxidant and anti-inflammatory properties. Cardamom can be bought whole as pods or ground into a powder and is used in various cuisines, from Indian curries to Scandinavian baked goods and chai tea.",https://www.themealdb.com/images/ingredients/Green_Cardamom_Pods.png,
612,Black Cardamom Pods,"Cardamom is an aromatic spice from the seeds of plants in the ginger family, used to add a warm, sweet, and pungent flavor to both savory and sweet dishes. It is native to the Indian subcontinent and Indonesia, and is known for its potential health benefits, such as aiding digestion, controlling blood pressure, and boosting the immune system due to its antioxidant and anti-inflammatory properties. Cardamom can be bought whole as pods or ground into a powder and is used in various cuisines, from Indian curries to Scandinavian baked goods and chai tea.",https://www.themealdb.com/images/ingredients/Black_Cardamom_Pods.png,
613,Corned Beef,"Corned beef is salt-cured beef, traditionally a brisket, that has been preserved in a seasoned brine. The name ""corned"" comes from the large, ""corn-sized"" grains of salt historically used. It is now a popular dish often prepared by slow cooking or boiling, and its salty, savory flavor makes it a key ingredient in sandwiches and hashes.",https://www.themealdb.com/images/ingredients/Corned_Beef.png,Meat
616,Nutella,"Nutella is a brand of brown, sweetened hazelnut cocoa spread. Nutella is manufactured by the Italian company Ferrero and was introduced in 1964, although its first iteration dates to 1963.",https://www.themealdb.com/images/ingredients/Nutella.png,Confectionery
617,Feather blade beef,Braising cut of beef,https://www.themealdb.com/images/ingredients/Feather_blade_beef.png,Meat
618,Mature Cheddar,Mature cheddar cheese,https://www.themealdb.com/images/ingredients/Mature_Cheddar.png,Cheese
619,Beef Stock Cubes,Beef flavour stock ,https://www.themealdb.com/images/ingredients/Beef_Stock_Cubes.png,Sauce
620,Lean Minced Steak,"A steak is a cut of meat sliced across muscle fibers, sometimes including a bone. It is normally grilled or fried, and can be diced or cooked in sauce.

Steaks are most commonly cut from cattle (beefsteak), but can also be cut from bison, buffalo, camel, goat, horse, kangaroo,[1][2] sheep, ostrich, pigs, turkey, and deer, as well as various types of fish, especially salmon and large fish such as swordfish, shark, and marlin. Some cured meat, such as gammon, is commonly served as steak. Some cuts are categorized as steaks not because they are cut across the muscle fibers, but because they are relatively thin and cooked over a grill, such as skirt steak and flank steak.",https://www.themealdb.com/images/ingredients/Lean_Minced_Steak.png,Meat
621,Cooked Beetroot,"Beetroot is a versatile root vegetable known for its sweet, earthy flavor and vibrant color, which can be used in a wide range of dishes like soups, stews, and salads. Beyond the root, the plant's leaves (beet greens) are also edible, and the vegetable is highly nutritious, containing vitamins, minerals, and fiber. It can be cooked in various ways, including roasted, boiled, or pickled, and some varieties are even used in desserts. ",https://www.themealdb.com/images/ingredients/Cooked_Beetroot.png,Root Vegetable
622,Soured cream and chive dip,"A soured cream and chive dip is a dip made from fermented sour cream, finely chopped chives, and other ingredients like mayonnaise, garlic, and lemon juice. It's a popular appetizer served with snacks like potato chips and vegetable sticks, or used as a topping for baked potatoes. 
Base ingredients: The base is typically sour cream, which is made by fermenting cream with lactic acid bacteria, giving it a thick and tangy texture.
Key additions: The signature flavor comes from fresh, finely diced chives. Other common additions include mayonnaise, garlic, lemon juice, salt, and pepper.
Uses: It is commonly served as a dip for chips, crackers, and raw vegetables. It can also be used as a spread for sandwiches and wraps or as a topping for baked potatoes. ",https://www.themealdb.com/images/ingredients/Soured_cream_and_chive_dip.png,Dressing
623,Unwaxed Lemon,"Unwaxed lemons are lemons without a wax coating, making them ideal for using the zest, as they are often sold for both cooking and vegan purposes. While they are free of the artificial wax, they may have a natural fungicide coating for preservation, so it's important to wash them thoroughly before use. You can find unwaxed lemons at most grocery stores, often labeled as organic or specifically marketed as ""unwaxed"". 
Benefits and uses
Edible zest: The peel can be used for zesting in recipes for cakes, biscuits, and other dishes.
Suitable for vegans: Since there is no wax coating, they are suitable for vegan recipes.
Versatile cooking: They are a staple for adding a bright, tangy flavor to marinades, dressings, roasted meat, fish, and sauces.
Garnish: They make a refreshing garnish for drinks. ",https://www.themealdb.com/images/ingredients/Unwaxed_Lemon.png,Fruit
624,Cocoa Powder,"Cocoa powder is made from roasted and fermented cacao beans that are ground into a powder after most of the fat (cocoa butter) has been extracted. The process involves roasting the beans, separating the shells from the inner nibs, and then pressing the nibs to remove the fatty cocoa butter, leaving a solid ""cake"" that is then pulverized into powder.  
Roasting: The cacao beans are roasted to develop their flavor. 
Winnowing: The roasted beans are cracked and the outer shells are removed, leaving the inner nibs. 
Grinding and pressing: The nibs are ground into a paste called ""chocolate liquor,"" which contains both solids and cocoa butter. A hydraulic press is used to squeeze out most of the cocoa butter, resulting in a ""cocoa cake"". 
Powdering: The remaining cocoa cake is then pulverized into a fine powder to create cocoa powder. 
There are two main types of cocoa powder:
Natural cocoa powder: This is the result of the process described above and has a more acidic and bitter taste. 
Dutch-processed cocoa powder: This has been treated with an alkaline solution to neutralize its acidity, resulting in a darker color and milder flavor. ",https://www.themealdb.com/images/ingredients/Cocoa_Powder.png,Confectionery
625,Can of chickpeas," they are a legume and are botanically classified as a seed. While they are used in cooking like a vegetable, they are the edible seeds that grow inside a pod on a plant, similar to other legumes like peas and beans. Root vegetables are plants where the edible part grows underground, such as carrots or potatoes. 
Botanical classification: Chickpeas belong to the legume family and are the seeds of the Cicer arietinum plant.
Growth process: The seeds grow inside pods on a bushy plant. When you purchase dried chickpeas, you are buying the fully mature seeds that have been harvested after the plant has dried out.
Comparison to root vegetables: Root vegetables, like carrots or beets, are the swollen, underground roots of the plant, which is a fundamentally different part of the plant from a chickpea seed.
Culinary vs. botanical classification: In cooking, chickpeas are often grouped with vegetables because they are used in many of the same dishes, such as salads, soups, and stews. However, this is a culinary distinction, not a botanical one. ",https://www.themealdb.com/images/ingredients/Can_of_chickpeas.png,Legume
