idIngredient,strIngredient,strDescription,strThumb,strType
825,Pork Back Ribs,"Baby Back Ribs | Pork Loin Ribs | The Village ButchersPork back ribs, also known as baby back ribs, are a cut from the top of the pig's rib cage, near the spine, after the loin has been removed. They are known for being leaner and more tender than spare ribs and have a curved shape. This cut is highly prized for its flavor and tenderness, often prepared with slow cooking methods to make the meat juicy and tender. ",https://www.themealdb.com/images/ingredients/Pork_Back_Ribs.png,Meat
826,Rye,"Rye is a cereal grain similar to wheat and barley that is primarily used to make bread, and is also used for alcoholic beverages like whiskey and beer, or as animal feed. It is a nutritious grain, high in fiber and rich in B vitamins and minerals. Rye flour contains less gluten than wheat flour, resulting in denser, richer-tasting bread that can have a long shelf life. 
Uses
Bread: A key ingredient in many breads, especially in Eastern and Northern Europe. It is often mixed with wheat flour to give the dough elasticity for a better rise. Popular examples include dense, dark pumpernickel and lighter rye breads.
Beverages: The grain is a key ingredient in rye whiskey, and is also used to make other alcoholic drinks like German Roggenbier and kvass.
Animal feed: Rye is widely used for feeding livestock.
Other uses: Whole rye berries can be cooked for cereal or added to salads and soups. The tough straw can be used for thatching, and the flour can be used as an adhesive. 
Nutritional benefits
High in fiber: Rye is one of the highest-fiber cereal grains, containing both water-soluble and insoluble fiber that is beneficial for digestion.
Rich in nutrients: It is a good source of B vitamins, and minerals such as iron, manganese, phosphorus, and selenium.
Phytonutrients: Whole-grain rye contains phytonutrients that may offer health benefits, such as protecting against heart disease and type 2 diabetes. 
Growing conditions
Rye can grow in cooler climates and poorer soil than wheat.
The main growing regions are in Europe, particularly Germany, Poland, Russia, and the Nordic countries, with some cultivation also in North America. ",https://www.themealdb.com/images/ingredients/Rye.png,Meat
827,Poppy Seeds,"Poppy seeds are tiny, kidney-shaped oilseeds from the Papaver somniferum poppy plant, used whole or ground in cooking for thousands of years, especially in Central Europe and South Asia. They are also pressed to create poppyseed oil. While Papaver somniferum is also the source of opium for the pharmaceutical industry, many varieties have been specifically bred to be low in opium content, making the seeds safe for culinary use. ",https://www.themealdb.com/images/ingredients/Poppy_Seeds.png,Legume
828,Wholegrain Mustard,"Wholegrain mustard is a condiment made from whole, unground mustard seeds, giving it a coarse texture and a robust, tangy flavor. Unlike smooth mustards, it retains the seeds, which provides a pleasant crunch and a more pronounced ""bite"". It is versatile, used as a table condiment, in sandwiches, marinades, sauces, and salad dressings. 
Key characteristics
Texture: Retains the whole seeds, creating a grainy and textured product.
Flavor: Robust, tangy, and slightly spicy, with a distinct mustard flavor profile.
Ingredients: Typically made with whole mustard seeds blended with vinegar (like cider or white wine), water, and salt.
Versatility: A very versatile ingredient that works well in many dishes. 
Common uses
As a condiment: Perfect for serving with roasted meats, sausages, and charcuterie.
In sandwiches: Adds a flavorful and crunchy element to sandwiches.
In sauces: A great way to add depth and texture to cheese sauces or other hot sauces.
In marinades and dressings: Whisked into vinaigrettes for a tangy kick or used in marinades for meats. ",https://www.themealdb.com/images/ingredients/Wholegrain_Mustard.png,Dressing
829,Kabanos Sausages,"Kabanos sausages are red due to the pork and spices used, combined with a smoking and drying process that gives them a dark red color and a smoky flavor. They are a type of long, thin, dry sausage originating from Poland, typically made of pork, and are often eaten as a snack. 
Ingredients and process: Kabanos is made from pork that is spiced with pepper, nutmeg, sugar, and caraway. After being stuffed into sheep casings, the sausages are smoked and hung to dry. This process concentrates the flavor and results in the sausage's characteristic dark red color.
Flavor: The ""redness"" is not from artificial coloring but from the natural reaction of the meat and spices during the smoking and drying process. The final product has an intense, smoky, and savory flavor with notes of pepper and caraway.
Variations: Some versions may have a ""chilli"" flavor, but this is specifically added and is different from the traditional color of the sausage. There are also other variations, such as those made with chicken or other ingredients. ",https://www.themealdb.com/images/ingredients/Kabanos_Sausages.png,Meat
830,Frozen Mixed Berries,"Mixed berries are a combination of several edible berries, most commonly including strawberries, blueberries, raspberries, and blackberries. This mix is popular because it offers a blend of sweet and tart flavors and is available fresh or frozen year-round. It's frequently used in desserts, smoothies, yogurts, and as a breakfast topping. ",https://www.themealdb.com/images/ingredients/Frozen_Mixed_Berries.png,Fruit
831,Blackcurrant Jam,"Blackcurrant jam is a fruit spread made from blackcurrants, sugar, and sometimes a little water. It is known for its rich, tangy, and deep fruity flavor and its dark color. The high natural pectin content in blackcurrants allows it to set well, often without added pectin or lemon juice. 
Ingredients: Primarily blackcurrants (fresh or frozen) and sugar. Water is often included to help the cooking process.
Preparation: The fruit is cooked with sugar and water until it breaks down and thickens into a jam. Some recipes might require additional ingredients like lemon juice or pectin, depending on the desired consistency.
Flavor and appearance: It has an intense, tart flavor and a deep, glossy, dark purple-black color.
Uses: It is commonly spread on toast, scones, or porridge, and can also be used as a filling for cakes and pastries.
Texture: It is a jam, so it contains crushed fruit and seeds, giving it a slightly seedy texture. To make a smoother jam, the cooked fruit can be sieved before the sugar is added, or a blackcurrant jelly can be made instead. ",https://www.themealdb.com/images/ingredients/Blackcurrant_Jam.png,Fruit
832,Egg Wash,"How to Make an Egg Wash - The BakerMamaEgg wash is a mixture of beaten eggs, sometimes with a liquid like water or milk, that is brushed onto baked goods like pastries and bread before baking. It is used to create a golden-brown color, a shiny finish, and a crispier crust. It also helps seal the edges of filled pastries and acts as a binder to help toppings like seeds or sugar adhere to the dough. ",https://www.themealdb.com/images/ingredients/Egg_Wash.png,Dairy
833,Molasses,"Molasses is a thick, dark syrup that is a viscous byproduct of the sugar-making process from sugarcane or sugar beets. It is produced by boiling the juice to extract sugar crystals, leaving the molasses behind. Different types of molasses are created from successive boiling and extraction processes, resulting in varieties like light, dark, and blackstrap, which have varying flavors and nutrient levels.  
How it's made
Juice extraction: Sugarcane or sugar beets are crushed to extract their juice.
First boiling: The juice is boiled to produce sugar crystals, which are then removed.
Byproduct creation: The thick, dark syrup left over is molasses.
Repeat processing: The process is repeated, and each subsequent boiling and extraction creates a different type of molasses. 
Types of molasses
Light molasses: Results from the first boiling, it is the lightest in color and sweetest in taste. 
Dark molasses: From the second boiling, it is thicker, darker, and less sweet than light molasses. 
Blackstrap molasses: The most processed, resulting from the third boiling. It is the darkest, thickest, and most bitter, but also the most nutrient-rich, containing higher levels of minerals like iron and potassium. 
Uses and characteristics
Flavor: It has a rich, bittersweet flavor that is used to sweeten and flavor foods and drinks. 
Nutritional content: Molasses is a source of minerals such as calcium, potassium, and iron, though it should still be consumed in moderation due to its high sugar content. 
Culinary uses: It is used in many recipes, including baked goods, barbecue sauces, and is what gives commercial brown sugar its color. 
Non-culinary uses: In some cases, sugar beet molasses is added to animal feeds because it is too bitter for human consumption. ",https://www.themealdb.com/images/ingredients/Molasses.png,Dressing
834,Bread Flour,"Bread flour is a high-protein white flour made from hard wheat that is ideal for baking because its protein content, typically between 12-14%, creates a strong, elastic gluten network when kneaded. This results in dough that can rise well and produce a chewier texture, making it suitable for loaves, bagels, and pretzels. 
What makes it different
High protein content: Bread flour has a significantly higher protein content than all-purpose flour, typically 12-14% protein compared to 10-11.7% for all-purpose.
Source: It is milled from hard wheat varieties, which are higher in protein.
Gluten development: The high protein content allows for more gluten to form when the flour is mixed with water and kneaded.
Elasticity: This gluten forms an elastic and stretchy structure that gives bread a chewy quality and allows it to rise with a good structure.
""Thirsty"" flour: Bread flour absorbs more water, so recipes may need adjustments for moisture. 
Best for
Artisan loaves and sourdough bread
Bagels and pretzels
Any baked good that requires a strong structure and chewy texture 
Not ideal for
Cakes, muffins, and other tender baked goods where you want a softer texture ",https://www.themealdb.com/images/ingredients/Bread_Flour.png,Grain
835,Unsweetened Cocoa,"Unsweetened cocoa powder is made from dried cocoa bean solids with the cocoa butter removed and no sugar or other ingredients added. It has a naturally bitter, intense chocolate flavor and is a common baking ingredient, though it is not typically eaten on its own and needs a sweetener to be palatable. It's available in two main types: natural, which is more acidic and lighter in color, and Dutch-processed, which is treated to be milder and darker.  ",https://www.themealdb.com/images/ingredients/Unsweetened_Cocoa.png,Seasoning
836,Coconut Flakes,"Coconut flakes are shredded pieces of dried coconut flesh, prized for their versatility in both sweet and savory dishes. They have a chewy texture and a sweet, nutty flavor that can be enhanced by toasting. They are a good source of fiber, protein, and nutrients like manganese and vitamin E, and can be used in baking, as a topping for breakfast foods, or added to snacks and curries. 
Uses
Baking: Sprinkle on top of or mix into muffins, cookies, and cakes for added texture and flavor.
Breakfast: Top oatmeal, yogurt, or granola with coconut flakes for a crunchy addition.
Snacks: Incorporate into trail mixes, energy balls, or eat them plain after toasting.
Savory dishes: Add to curries, stir-fries, or salads for a tropical twist.
Topping: Garnish desserts, smoothies, and smoothie bowls. 
Types
Unsweetened: Plain coconut with no added sugar, which tends to be drier and chewier.
Sweetened: Has added sugar, making it moister and sweeter.
Toasted: The flakes have been toasted to bring out a nuttier flavor and a golden-brown color. 
Benefits
Source of nutrients: Contains manganese, vitamin E, and fiber.
Promotes health: Can help with reducing inflammation, promoting heart health, and balancing glucose levels. ",https://www.themealdb.com/images/ingredients/Coconut_Flakes.png,Fruit
837,Peach Juice,"Peach juice is a beverage made from peaches, often sweetened and mixed with water. It is a good source of vitamins like A and C, and minerals like potassium, and can be made at home by blending peaches with water, lemon juice, and a sweetener, or bought commercially as a juice or nectar. ",https://www.themealdb.com/images/ingredients/Peach_Juice.png,Sauce
838,Cornmeal,"Cornmeal is a coarse flour made from dried maize (corn) kernels, which comes in fine, medium, and coarse grinds. It is a staple food used in dishes like cornbread, polenta, and tortillas, and is naturally gluten-free. 
Composition: It is made from whole dried corn kernels, though commercial cornmeal is often ""degerminated,"" meaning the oily germ and bran are removed during processing.
Texture and types: The texture varies from fine to coarse and can be white or yellow, depending on the type of corn used.
Corn flour: Extremely finely ground cornmeal is sometimes called corn flour.
Masa harina: When cornmeal is made from corn soaked in an alkaline solution (a process called nixtamalization), it is called masa harina, used for making tortillas and tamales.
Polenta: The term ""polenta"" refers to boiled cornmeal, often served as a porridge or bread substitute.
Uses: It is used in a wide variety of recipes, including quick breads, muffins, and as a coating for fried foods.
Dietary notes: Cornmeal is naturally gluten-free, making it suitable for those with gluten allergies or celiac disease. ",https://www.themealdb.com/images/ingredients/Cornmeal.png,Sauce
839,Hind Shank,"A hind shank is a cut of meat from the lower hind leg of an animal, such as a cow or lamb. It is a tough, muscular cut rich in connective tissue and bone marrow, making it ideal for slow cooking methods like braising, stewing, or roasting. When cooked low and slow, it becomes very tender and the gelatin from the connective tissues creates a rich, flavorful dish. 
Characteristics
Cut location: From the lower hind leg of the animal.
Texture: Naturally tough due to being a hardworking muscle, but becomes exceptionally tender when slow-cooked.
Flavor: Deep, rich, and beefy flavor comes from the meat and marrow-rich bone.
Composition: High in connective tissue and bone marrow. 
Cooking
Best methods: Slow cooking, braising, or slow roasting.
Why it works: Long, slow cooking breaks down the connective tissue into gelatin, which tenderizes the meat and enriches the cooking liquid.
Serving: Can be served whole as a main dish, shredded, or used in soups and stews.
Bonus: The bones can be used to make a flavorful bone broth after the meat is cooked. ",https://www.themealdb.com/images/ingredients/Hind_Shank.png,Meat
840,Sweet Red Peppers,"Sweet red peppers are the fully mature, sweet-tasting versions of green bell peppers, belonging to the Capsicum annuum species. They are not spicy because a recessive gene prevents the production of capsaicin, the compound that causes heat. Rich in vitamin C and antioxidants, they have a mildly sweet flavor and are used in a variety of dishes both raw and cooked. 
Characteristics and cultivation
Ripeness: Green peppers are unripe, while red, yellow, and orange peppers are progressively riper and sweeter as they mature.
Flavor: They have a mildly sweet and earthy taste, unlike the more bitter green pepper.
Cultivation: Sweet peppers are tender plants that need warmth and sun. They are often grown indoors in a greenhouse or conservatory in cooler climates.
Growth: Plants are relatively small and can grow well in large pots. 
Nutritional benefits
Rich in vitamins: Sweet red peppers are a very rich source of vitamin C and antioxidants.
High in carotenes: Red peppers contain nine times more carotene than other colored peppers and twice the amount of vitamin C compared to green ones. 
Culinary uses
Versatile: They can be eaten raw in salads, sliced, or stuffed, and are also delicious when cooked.
Common dishes: They are used in stir-fries, roasted dishes, soups, stews, and as a base for other sauces.
Dried form: Bell peppers are sometimes dried and powdered to make paprika. ",https://www.themealdb.com/images/ingredients/Sweet_Red_Peppers.png,Root Vegetable
841,Cassaba,"Casaba is a type of sweet, non-aromatic melon with a wrinkled, yellow rind and pale, whitish flesh. It is a winter melon, known for its hardiness and long shelf life, and is botanically classified as a variety of Cucumis melo. Unlike cantaloupe, its rind is not netted, and unlike honeydew, it has a rough, deeply ridged skin, sometimes with a pointed stem end.  
Characteristics of a casaba melon
Appearance: Wrinkled, golden-yellow skin and an oval or slightly pointed shape. 
Flesh: Sweet, juicy, and white or pale yellow, with a flavor that is less sugary and can have a slight spiciness compared to other melons. 
Aroma: It has little to no aroma, even when ripe. 
Harvesting: Casabas don't ""slip"" from the vine when ripe like other melons, so they must be harvested manually by cutting the stem once they are mature. 
Storage: Its thick, tough rind makes it a good choice for winter storage. 
Culinary uses
Casaba melons can be eaten fresh as a dessert or used in both sweet and savory dishes.
They are a good source of vitamins C and B6, as well as folate. ",https://www.themealdb.com/images/ingredients/Cassaba.png,Fruit
842,Yautia,"Yautia is a starchy, edible root vegetable, also known as malanga or cocoyam, that is popular in Caribbean, South American, and African cuisine. It has a rough, hairy, brown skin and crisp white or pinkish flesh with a nutty, earthy flavor. It is prepared by boiling, frying, or stewing and can be mashed or ground into a flour or paste for other dishes. 
Characteristics
Appearance: Has a bumpy, shaggy, brown skin and flesh that can be white, yellow, or purplish.
Texture: The raw flesh is crisp but becomes slippery and starchy when cooked.
Flavor: Nutty and earthy with a consistency that is slightly waxy when cooked. 
Culinary uses
Soups and stews: Often used in dishes like sancocho and mondongo.
Mashed: Can be prepared as a mashed side dish, called yautía majada.
Ground: Used to make dough-like pastes for dishes like pasteles or ground into flour.
Fried: Made into croquettes, like alcapurrias.
Leaves: The young leaves can be cooked like other leafy greens, such as in the Jamaican dish callaloo. ",https://www.themealdb.com/images/ingredients/Yautia.png,Root Vegetable
843,White Yam,"Sweet Potatoes vs Yams: What's the Difference?White yam is a starchy, white-fleshed root vegetable, scientifically known as Dioscorea cayenensis subsp. rotundata, that is a staple food in many parts of Africa, Asia, and the Caribbean. It has a mild, earthy flavor and a dense texture, making it ideal for savory dishes where it can absorb spices, though it is also versatile enough for roasting, mashing, and frying. 
Characteristics
Appearance: Has a brown, rough skin and a firm, starchy white flesh.
Flavor and texture: Mild, earthy, and starchy, with a dense texture that is less sweet than a sweet potato.
Nutritional profile: A good source of fiber, vitamins, and minerals, and also contains diosgenin. 
Culinary uses
Boiling: Boil until tender and serve with curries or stews, or use to make pounded yam.
Roasting: Cube and roast with olive oil and seasonings.
Mashing: Mash with butter or other fats for a hearty side dish.
Frying: Slice thinly and fry into crispy chips.
Soups and stews: Add cubes to soups or stews to add body and flavor. 
Other facts
White yams are distinct from sweet potatoes, although the term ""white yam"" is sometimes used to describe certain varieties of white-fleshed sweet potatoes.
The scientific name for African white yam is Dioscorea cayenensis subsp. rotundata. ",https://www.themealdb.com/images/ingredients/White_Yam.png,Root Vegetable
844,Papelon,"Papelón is unrefined whole cane sugar, common in Latin America, made from boiled and evaporated sugarcane juice and typically sold in solid, brown-colored blocks. It is also the name of a popular Venezuelan drink called papelón con limón, a refreshing lemonade made from papelón, water, and lime juice. 
As a sugar product
Composition: It is unrefined whole cane sugar, also known as panela or piloncillo.
Forms: It is sold in various shapes, including round, square, or cone-shaped blocks.
Uses: It can be used as a sugar substitute in many recipes, including coffee, teas, and savory dishes. 
As a drink
Name: The drink is called papelón con limón (also known as aguapanela fria).
Ingredients: It is made from papelón, fresh lime juice, and water.
Flavor: It is a sweet and refreshing beverage, sometimes described as a traditional Venezuelan lemonade. y, and starchy, with a dense texture that is less sweet than a sweet potato.
Nutritional profile: A good source of fiber, vitamins, and minerals, and also contains diosgenin. 
Culinary uses
Boiling: Boil until tender and serve with curries or stews, or use to make pounded yam.
Roasting: Cube and roast with olive oil and seasonings.
Mashing: Mash with butter or other fats for a hearty side dish.
Frying: Slice thinly and fry into crispy chips.
Soups and stews: Add cubes to soups or stews to add body and flavor. 
Other facts
White yams are distinct from sweet potatoes, although the term ""white yam"" is sometimes used to describe certain varieties of white-fleshed sweet potatoes.
The scientific name for African white yam is Dioscorea cayenensis subsp. rotundata. ",https://www.themealdb.com/images/ingredients/Papelon.png,Seasoning
845,Skirty Steak,"Skirt steak is a long, thin cut of beef from the diaphragm muscle of the cow, known for its rich, beefy flavor and coarse grain. It's a tougher cut that requires fast, high-heat cooking like grilling or pan-searing to medium-rare to stay tender, and is often used for dishes like steak tacos and fajitas. It is essential to slice the meat against the grain after cooking to ensure it isn't chewy. 
Characteristics
Cut: Comes from the short plate primal, a muscular area below the ribs.
Flavor: Has a very rich and intense beef flavor.
Texture: Coarse-grained and can become tough if overcooked.
Cooking: Best cooked to medium-rare and sliced against the grain for tenderness. 
Types of skirt steak
Outside skirt: Located on the outside of the diaphragm, this cut is generally more tender, thicker, and more uniformly shaped than the inside skirt steak. It's often preferred in restaurants.
Inside skirt: This cut is wider and has a chewier texture. It is often the type found in grocery stores. 
Cooking tips
Marinate: Due to its toughness, marinating skirt steak is often recommended to help tenderize it.
Sear quickly: Use a hot grill or pan to cook the steak quickly, watching closely to avoid overcooking.
Slice against the grain: After cooking, slice the meat against the long muscle fibers to ensure it is tender to eat.
Pairing: It is frequently paired with sauces like chimichurri to provide a bright, acidic contrast to the rich meat. ",https://www.themealdb.com/images/ingredients/Skirty_Steak.png,Meat
846,White Masarepa,"White masarepa is a finely ground, pre-cooked white cornmeal, a staple ingredient in many Latin American dishes, particularly Venezuelan and Colombian cuisine. It is made from 100% white corn and is the key ingredient for making foods like arepas, empanadas, and tamales. The flour is mixed with water to form a dough and is naturally gluten-free. 
Main use: White masarepa is the primary ingredient for making arepas, which are a type of corn cake that can be stuffed with various fillings.
Other uses: It is also used to make other dishes like empanadas, tortillas, and tamales.
Preparation: It is pre-cooked, meaning it requires only water and salt to create a soft, flexible dough that can be cooked quickly.
Dietary information: It is naturally gluten-free, making it a good option for those with gluten sensitivities.
Texture: It has a finer and softer texture compared to masa harina, which is used for tortillas and is nixtamalized (cooked with an alkali). ",https://www.themealdb.com/images/ingredients/White_Masarepa.png,Grain
847,Casabe,"Casabe is a traditional, thin, crunchy, and gluten-free flatbread made from yuca (cassava) root. Originating from the Taíno indigenous people of the Caribbean, the process involves grating the yuca, pressing out the toxic juice, and then baking the pulp into a crisp bread. It is a staple in many Caribbean countries, with its preparation recognized by UNESCO as a form of intangible cultural heritage. 
Ingredients: Casabe is typically made with just one ingredient: yuca flour.
Preparation: The traditional process involves grating and pressing the yuca to remove its poisonous juice before cooking it on a hot surface. This step is crucial as raw yuca can contain a toxic substance that needs to be eliminated.
Characteristics: It is known for being a crispy, crunchy, and light flatbread. It can be found in both sweet and bitter varieties depending on the preparation.
Cultural significance: Casabe has been a part of the diet in the Caribbean for centuries and is considered one of the oldest foods in the region. It is a culinary heritage of the Taíno people.
Usage: It is a versatile bread that can be eaten on its own, served with local dishes, or used as a base for other foods, such as a gluten-free pizza crust or with sweet toppings like peanut butter. ",https://www.themealdb.com/images/ingredients/Casabe.png,Bread
